{
  "segment": "admin-live-empty-states",
  "timestamp": "2026-03-31T16:24:39.087Z",
  "verdict": "PASS",
  "checks": [
    {
      "id": "hygiene.env-example",
      "required": true,
      "status": "passed",
      "command": "node scripts/check-env-example.mjs",
      "duration_ms": 32,
      "stdout": "[check:env-example] PASS\n",
      "stderr": ""
    },
    {
      "id": "hygiene.tracked-secrets-scan",
      "required": true,
      "status": "passed",
      "command": "node scripts/check-tracked-secrets.mjs",
      "duration_ms": 103,
      "stdout": "[check:secrets] PASS\n",
      "stderr": ""
    },
    {
      "id": "hygiene.npm-audit",
      "required": true,
      "status": "passed",
      "command": "npm run audit:ci",
      "duration_ms": 697,
      "stdout": "found 0 vulnerabilities\n",
      "stderr": ""
    },
    {
      "id": "security.gitleaks",
      "required": true,
      "status": "passed",
      "command": "npm run secrets:gitleaks",
      "duration_ms": 7427,
      "stdout": "[gitleaks] PASS\n",
      "stderr": "\n    â—‹\n    â”‚â•˛\n    â”‚ â—‹\n    â—‹ â–‘\n    â–‘    gitleaks\n\n\u001b[90m4:24PM\u001b[0m \u001b[32mINF\u001b[0m 50 commits scanned.\n\u001b[90m4:24PM\u001b[0m \u001b[32mINF\u001b[0m scan completed in 716ms\n\u001b[90m4:24PM\u001b[0m \u001b[32mINF\u001b[0m no leaks found\n"
    },
    {
      "id": "qa.eslint",
      "required": true,
      "status": "passed",
      "command": "npm run lint",
      "duration_ms": 2726,
      "stdout": "\n/Users/brianlewis/Circle of Life/Circle-of-Life/src/components/landing/landing-home.tsx\n    3:8   warning  'dynamic' is defined but never used                                                                                                                                                                                                                                                      @typescript-eslint/no-unused-vars\n   29:8   warning  'Image' is defined but never used                                                                                                                                                                                                                                                        @typescript-eslint/no-unused-vars\n  254:15  warning  Using `<img>` could result in slower LCP and higher bandwidth. Consider using `<Image />` from `next/image` or a custom image loader to automatically optimize images. This may incur additional usage or cost from your provider. See: https://nextjs.org/docs/messages/no-img-element  @next/next/no-img-element\n\nâś– 3 problems (0 errors, 3 warnings)\n\n",
      "stderr": ""
    },
    {
      "id": "qa.migration-sequence",
      "required": true,
      "status": "passed",
      "command": "npm run migrations:check",
      "duration_ms": 110,
      "stdout": "[migrations:check] PASS: 29 migration(s) in /Users/brianlewis/Circle of Life/Circle-of-Life/supabase/migrations â€” sequence 001..029\n",
      "stderr": ""
    },
    {
      "id": "qa.migrations-apply-postgres",
      "required": false,
      "status": "passed",
      "command": "npm run migrations:verify:pg",
      "duration_ms": 13589,
      "stdout": "[migrations:verify:pg] PASS (29 migration file(s))\n",
      "stderr": ""
    },
    {
      "id": "qa.root-build",
      "required": true,
      "status": "passed",
      "command": "npm run build",
      "duration_ms": 9696,
      "stdout": "[migrations:check] PASS: 29 migration(s) in /Users/brianlewis/Circle of Life/Circle-of-Life/supabase/migrations â€” sequence 001..029\nâ–˛ Next.js 16.2.1 (Turbopack)\n- Environments: .env.local\n\n  Creating an optimized production build ...\nâś“ Compiled successfully in 3.9s\n  Running TypeScript ...\n  Finished TypeScript in 4.1s ...\n  Collecting page data using 15 workers ...\n  Generating static pages using 15 workers (0/64) ...\n  Generating static pages using 15 workers (16/64) \r\n  Generating static pages using 15 workers (32/64) \r\n  Generating static pages using 15 workers (48/64) \r\nâś“ Generating static pages using 15 workers (64/64) in 427ms\n  Finalizing page optimization ...\n\nRoute (app)\nâ”Ś â—‹ /\nâ”ś â—‹ /_not-found\nâ”ś â—‹ /admin\nâ”ś â—‹ /admin/assessments/overdue\nâ”ś â—‹ /admin/billing\nâ”ś â—‹ /admin/billing/ar-aging\nâ”ś â—‹ /admin/billing/invoices\nâ”ś Ć’ /admin/billing/invoices/[id]\nâ”ś â—‹ /admin/billing/invoices/generate\nâ”ś â—‹ /admin/billing/org-ar-aging\nâ”ś â—‹ /admin/billing/payments/new\nâ”ś â—‹ /admin/billing/rates\nâ”ś â—‹ /admin/billing/revenue\nâ”ś â—‹ /admin/care-plans/reviews-due\nâ”ś â—‹ /admin/certifications\nâ”ś â—‹ /admin/incidents\nâ”ś Ć’ /admin/incidents/[id]\nâ”ś Ć’ /admin/incidents/[id]/rca\nâ”ś â—‹ /admin/incidents/trends\nâ”ś â—‹ /admin/residents\nâ”ś Ć’ /admin/residents/[id]\nâ”ś Ć’ /admin/residents/[id]/billing\nâ”ś Ć’ /admin/residents/[id]/care-plan\nâ”ś â—‹ /admin/schedules\nâ”ś â—‹ /admin/staff\nâ”ś Ć’ /admin/staff/[id]\nâ”ś â—‹ /admin/staffing\nâ”ś â—‹ /admin/time-records\nâ”ś â—‹ /assessments/overdue\nâ”ś â—‹ /billing\nâ”ś â—‹ /billing/ar-aging\nâ”ś â—‹ /billing/invoices\nâ”ś Ć’ /billing/invoices/[id]\nâ”ś â—‹ /billing/invoices/generate\nâ”ś â—‹ /billing/org-ar-aging\nâ”ś â—‹ /billing/payments/new\nâ”ś â—‹ /billing/rates\nâ”ś â—‹ /billing/revenue\nâ”ś â—‹ /care-plans/reviews-due\nâ”ś â—‹ /caregiver\nâ”ś â—‹ /caregiver/followups\nâ”ś â—‹ /caregiver/handoff\nâ”ś â—‹ /caregiver/incident-draft\nâ”ś â—‹ /caregiver/me\nâ”ś â—‹ /caregiver/meds\nâ”ś â—‹ /caregiver/prn-followup\nâ”ś Ć’ /caregiver/resident/[id]\nâ”ś Ć’ /caregiver/resident/[id]/adl\nâ”ś Ć’ /caregiver/resident/[id]/behavior\nâ”ś Ć’ /caregiver/resident/[id]/condition-change\nâ”ś Ć’ /caregiver/resident/[id]/log\nâ”ś â—‹ /caregiver/tasks\nâ”ś â—‹ /certifications\nâ”ś â—‹ /family\nâ”ś â—‹ /family/billing\nâ”ś â—‹ /family/calendar\nâ”ś â—‹ /family/care-plan\nâ”ś â—‹ /family/invoices\nâ”ś â—‹ /family/messages\nâ”ś â—‹ /family/payments\nâ”ś â—‹ /followups\nâ”ś â—‹ /handoff\nâ”ś â—‹ /incident-draft\nâ”ś â—‹ /incidents\nâ”ś Ć’ /incidents/[id]\nâ”ś Ć’ /incidents/[id]/rca\nâ”ś â—‹ /incidents/trends\nâ”ś â—‹ /login\nâ”ś â—‹ /me\nâ”ś â—‹ /meds\nâ”ś â—‹ /prn-followup\nâ”ś Ć’ /resident/[id]\nâ”ś Ć’ /resident/[id]/adl\nâ”ś Ć’ /resident/[id]/behavior\nâ”ś Ć’ /resident/[id]/condition-change\nâ”ś Ć’ /resident/[id]/log\nâ”ś â—‹ /residents\nâ”ś Ć’ /residents/[id]\nâ”ś Ć’ /residents/[id]/billing\nâ”ś Ć’ /residents/[id]/care-plan\nâ”ś â—‹ /schedules\nâ”ś â—‹ /staff\nâ”ś Ć’ /staff/[id]\nâ”ś â—‹ /staffing\nâ”ś â—‹ /tasks\nâ”” â—‹ /time-records\n\n\nĆ’ Proxy (Middleware)\n\nâ—‹  (Static)   prerendered as static content\nĆ’  (Dynamic)  server-rendered on demand\n\n",
      "stderr": ""
    },
    {
      "id": "hygiene.nextjs-deprecation-signal",
      "required": false,
      "status": "passed",
      "command": "(derived from npm run build output)",
      "stdout": "No tracked Next.js middleware deprecation signal in build output."
    },
    {
      "id": "qa.web-build",
      "required": false,
      "status": "skipped",
      "command": "npm run build (apps/web)",
      "stdout": "apps/web/package.json not found"
    },
    {
      "id": "chaos.stress-suite",
      "required": false,
      "status": "skipped",
      "command": "npm run stress:test",
      "stdout": "skipped (--no-chaos)"
    },
    {
      "id": "cdo.design-review",
      "required": false,
      "status": "skipped",
      "command": "npm run design:review",
      "stdout": "skipped (pass --ui to enable)"
    },
    {
      "id": "cdo.a11y-axe",
      "required": false,
      "status": "skipped",
      "command": "npm run a11y:routes",
      "stdout": "skipped (pass --ui to enable; omit --no-a11y)"
    }
  ],
  "summary": {
    "passed": 9,
    "failed": 0,
    "skipped": 4,
    "blocking_failures": []
  },
  "artifacts": [
    "/Users/brianlewis/Circle of Life/Circle-of-Life/test-results/agent-gates/2026-03-31T16-24-39-087Z-admin-live-empty-states.json"
  ]
}