{
  "segment": "ui-family-feed-scaffold",
  "timestamp": "2026-03-31T12:30:07.870Z",
  "verdict": "PASS",
  "checks": [
    {
      "id": "hygiene.env-example",
      "required": true,
      "status": "passed",
      "command": "node scripts/check-env-example.mjs",
      "duration_ms": 30,
      "stdout": "[check:env-example] PASS\n",
      "stderr": ""
    },
    {
      "id": "hygiene.tracked-secrets-scan",
      "required": true,
      "status": "passed",
      "command": "node scripts/check-tracked-secrets.mjs",
      "duration_ms": 146,
      "stdout": "[check:secrets] PASS\n",
      "stderr": ""
    },
    {
      "id": "hygiene.npm-audit",
      "required": true,
      "status": "passed",
      "command": "npm run audit:ci",
      "duration_ms": 766,
      "stdout": "found 0 vulnerabilities\n",
      "stderr": ""
    },
    {
      "id": "security.gitleaks",
      "required": true,
      "status": "passed",
      "command": "npm run secrets:gitleaks",
      "duration_ms": 10071,
      "stdout": "[gitleaks] PASS\n",
      "stderr": "\n    ‚óč\n    ‚Ēā‚ē≤\n    ‚Ēā ‚óč\n    ‚óč ‚ĖĎ\n    ‚ĖĎ    gitleaks\n\n\u001b[90m12:30PM\u001b[0m \u001b[32mINF\u001b[0m 23 commits scanned.\n\u001b[90m12:30PM\u001b[0m \u001b[32mINF\u001b[0m scan completed in 528ms\n\u001b[90m12:30PM\u001b[0m \u001b[32mINF\u001b[0m no leaks found\n"
    },
    {
      "id": "qa.eslint",
      "required": true,
      "status": "passed",
      "command": "npm run lint",
      "duration_ms": 1569,
      "stdout": "",
      "stderr": ""
    },
    {
      "id": "qa.migration-sequence",
      "required": true,
      "status": "passed",
      "command": "npm run migrations:check",
      "duration_ms": 111,
      "stdout": "[migrations:check] PASS: 29 migration(s) in /Users/brianlewis/Circle of Life/Circle-of-Life/supabase/migrations ‚ÄĒ sequence 001..029\n",
      "stderr": ""
    },
    {
      "id": "qa.migrations-apply-postgres",
      "required": false,
      "status": "passed",
      "command": "npm run migrations:verify:pg",
      "duration_ms": 14320,
      "stdout": "[migrations:verify:pg] PASS (29 migration file(s))\n",
      "stderr": ""
    },
    {
      "id": "qa.root-build",
      "required": true,
      "status": "passed",
      "command": "npm run build",
      "duration_ms": 6194,
      "stdout": "[migrations:check] PASS: 29 migration(s) in /Users/brianlewis/Circle of Life/Circle-of-Life/supabase/migrations ‚ÄĒ sequence 001..029\n‚Ė≤ Next.js 16.2.1 (Turbopack)\n\n  Creating an optimized production build ...\n‚úď Compiled successfully in 2.1s\n  Running TypeScript ...\n  Finished TypeScript in 2.7s ...\n  Collecting page data using 15 workers ...\n  Generating static pages using 15 workers (0/22) ...\n  Generating static pages using 15 workers (5/22) \r\n  Generating static pages using 15 workers (10/22) \r\n  Generating static pages using 15 workers (16/22) \r\n‚úď Generating static pages using 15 workers (22/22) in 254ms\n  Finalizing page optimization ...\n\nRoute (app)\n‚ĒĆ ‚óč /\n‚Ēú ‚óč /_not-found\n‚Ēú ‚óč /admin\n‚Ēú ‚óč /admin/billing\n‚Ēú ‚óč /admin/incidents\n‚Ēú ‚óč /admin/residents\n‚Ēú ‚óč /admin/staff\n‚Ēú ‚óč /billing\n‚Ēú ‚óč /caregiver\n‚Ēú ‚óč /caregiver/incident-draft\n‚Ēú ‚óč /caregiver/meds\n‚Ēú ∆í /caregiver/resident/[id]\n‚Ēú ‚óč /caregiver/tasks\n‚Ēú ‚óč /family\n‚Ēú ‚óč /incident-draft\n‚Ēú ‚óč /incidents\n‚Ēú ‚óč /login\n‚Ēú ‚óč /meds\n‚Ēú ∆í /resident/[id]\n‚Ēú ‚óč /residents\n‚Ēú ‚óč /staff\n‚ĒĒ ‚óč /tasks\n\n\n∆í Proxy (Middleware)\n\n‚óč  (Static)   prerendered as static content\n∆í  (Dynamic)  server-rendered on demand\n\n",
      "stderr": ""
    },
    {
      "id": "hygiene.nextjs-deprecation-signal",
      "required": false,
      "status": "passed",
      "command": "(derived from npm run build output)",
      "stdout": "No tracked Next.js middleware deprecation signal in build output."
    },
    {
      "id": "qa.web-build",
      "required": false,
      "status": "skipped",
      "command": "npm run build (apps/web)",
      "stdout": "apps/web/package.json not found"
    },
    {
      "id": "chaos.stress-suite",
      "required": false,
      "status": "skipped",
      "command": "npm run stress:test",
      "stdout": "skipped (--no-chaos)"
    },
    {
      "id": "cdo.design-review",
      "required": true,
      "status": "passed",
      "command": "npm run design:review",
      "duration_ms": 2045,
      "stdout": "[design:review] PASS: 4 screenshot(s) -> /Users/brianlewis/Circle of Life/Circle-of-Life/test-results/design-review/report.json\n",
      "stderr": "",
      "artifacts": [
        "/Users/brianlewis/Circle of Life/Circle-of-Life/test-results/design-review/report.json"
      ]
    },
    {
      "id": "cdo.a11y-axe",
      "required": true,
      "status": "passed",
      "command": "npm run a11y:routes",
      "duration_ms": 2249,
      "stdout": "[a11y:routes] PASS (1 route(s))\n",
      "stderr": ""
    }
  ],
  "summary": {
    "passed": 11,
    "failed": 0,
    "skipped": 2,
    "blocking_failures": []
  },
  "artifacts": [
    "/Users/brianlewis/Circle of Life/Circle-of-Life/test-results/agent-gates/2026-03-31T12-30-07-870Z-ui-family-feed-scaffold.json"
  ]
}