{
  "segment": "perf-auth-09-finance-client",
  "timestamp": "2026-06-30T03:14:08.698Z",
  "verdict": "FAIL",
  "checks": [
    {
      "id": "hygiene.env-example",
      "required": true,
      "command": "node scripts/check-env-example.mjs",
      "status": "passed",
      "duration_ms": 26,
      "stdout": "[check:env-example] PASS\n",
      "stderr": ""
    },
    {
      "id": "hygiene.tracked-secrets-scan",
      "required": true,
      "command": "node scripts/check-tracked-secrets.mjs",
      "status": "passed",
      "duration_ms": 153,
      "stdout": "[check:secrets] PASS\n",
      "stderr": ""
    },
    {
      "id": "hygiene.npm-audit",
      "required": true,
      "command": "npm run audit:ci",
      "status": "passed",
      "duration_ms": 808,
      "stdout": "# npm audit report\n\npostcss  <8.5.10\nSeverity: moderate\nPostCSS has XSS via Unescaped </style> in its CSS Stringify Output - https://github.com/advisories/GHSA-qx2v-qp2m-jg93\nfix available via `npm audit fix --force`\nWill install next@9.3.3, which is a breaking change\nnode_modules/next/node_modules/postcss\n  next  9.3.4-canary.0 - 16.3.0-canary.5\n  Depends on vulnerable versions of postcss\n  node_modules/next\n    @sentry/nextjs  >=6.3.6\n    Depends on vulnerable versions of next\n    node_modules/@sentry/nextjs\n\n3 moderate severity vulnerabilities\n\nTo address all issues (including breaking changes), run:\n  npm audit fix --force\n",
      "stderr": ""
    },
    {
      "id": "security.gitleaks",
      "required": true,
      "command": "npm run secrets:gitleaks",
      "status": "passed",
      "duration_ms": 5447,
      "stdout": "[gitleaks] PASS\n",
      "stderr": "\n    ○\n    │╲\n    │ ○\n    ○ ░\n    ░    gitleaks\n\n\u001b[90m3:14AM\u001b[0m \u001b[32mINF\u001b[0m 1242 commits scanned.\n\u001b[90m3:14AM\u001b[0m \u001b[32mINF\u001b[0m scan completed in 4.92s\n\u001b[90m3:14AM\u001b[0m \u001b[32mINF\u001b[0m no leaks found\n"
    },
    {
      "id": "qa.eslint",
      "required": true,
      "command": "npm run lint",
      "status": "passed",
      "duration_ms": 24561,
      "stdout": "Constitution lint passed for smart-rounding scope (23 files).\n",
      "stderr": "[BABEL] Note: The code generator has deoptimised the styling of /Users/brianlewis/Circle of Life/Circle-of-Life/src/types/database.ts as it exceeds the max of 500KB.\n"
    },
    {
      "id": "qa.migration-sequence",
      "required": true,
      "command": "npm run migrations:check",
      "status": "passed",
      "duration_ms": 143,
      "stdout": "[migrations:check] PASS: 309 migration(s) in /Users/brianlewis/Circle of Life/Circle-of-Life/supabase/migrations — sequence 001..306\n",
      "stderr": ""
    },
    {
      "id": "qa.migrations-apply-postgres",
      "required": false,
      "command": "npm run migrations:verify:pg",
      "status": "failed",
      "duration_ms": 28962,
      "stdout": "",
      "stderr": "[migrations:verify:pg] FAIL at 282_phase1_vendor_seed.sql\n ERROR:  duplicate key value violates unique constraint \"idx_vendors_org_name\"\nDETAIL:  Key (organization_id, lower(name))=(00000000-0000-0000-0000-000000000001, alternative transport) already exists.\nCONTEXT:  SQL statement \"INSERT INTO vendors (organization_id, name, category, status, primary_contact_name, primary_contact_phone, created_by)\n  VALUES (v_org_id, 'Alternative Transport', 'other', 'active', 'Kathy', NULL, '062c3cfb-53a5-4482-814a-cbef2b028760')\n  RETURNING id\"\nPL/pgSQL function inline_code_block line 8 at SQL statement\n\n[migrations:verify:pg] container logs:\n The files belonging to this database system will be owned by user \"postgres\".\nThis user must also own the server process.\n\nThe database cluster will be initialized with locale \"en_US.utf8\".\nThe default database encoding has accordingly been set to \"UTF8\".\nThe default text search configuration will be set to \"english\".\n\nData page checksums are disabled.\n\nfixing permissions on existing directory /var/lib/postgresql/data ... ok\ncreating subdirectories ... ok\nselecting dynamic shared memory implementation ... posix\nselecting default \"max_connections\" ... 100\nselecting default \"shared_buffers\" ... 128MB\nselecting default time zone ... Etc/UTC\ncreating configuration files ... ok\nrunning bootstrap script ... ok\nperforming post-bootstrap initialization ... ok\nsyncing data to disk ... ok\n\n\nSuccess. You can now start the database server using:\n\n    pg_ctl -D /var/lib/postgresql/data -l logfile start\n\nwaiting for server to start....2026-06-30 03:14:40.739 UTC [55] LOG:  starting PostgreSQL 17.10 (Debian 17.10-1.pgdg12+1) on aarch64-unknown-linux-gnu, compiled by gcc (Debian 12.2.0-14+deb12u1) 12.2.0, 64-bit\n2026-06-30 03:14:40.741 UTC [55] LOG:  listening on Unix socket \"/var/run/postgresql/.s.PGSQL.5432\"\n2026-06-30 03:14:40.744 UTC [58] LOG:  database system was shut down at 2026-06-30 03:14:40 UTC\n2026-06-30 03:14:40.747 UTC [55] LOG:  database system is ready to accept connections\n done\nserver started\n\n/usr/local/bin/docker-entrypoint.sh: ignoring /docker-entrypoint-initdb.d/*\n\nwaiting for server to shut down...2026-06-30 03:14:40.858 UTC [55] LOG:  received fast shutdown request\n.2026-06-30 03:14:40.859 UTC [55] LOG:  aborting any active transactions\n2026-06-30 03:14:40.860 UTC [55] LOG:  background worker \"logical replication launcher\" (PID 61) exited with exit code 1\n2026-06-30 03:14:40.861 UTC [56] LOG:  shutting down\n2026-06-30 03:14:40.862 UTC [56] LOG:  checkpoint starting: shutdown immediate\n2026-06-30 03:14:40.869 UTC [56] LOG:  checkpoint complete: wrote 3 buffers (0.0%); 0 WAL file(s) added, 0 removed, 0 recycled; write=0.003 s, sync=0.001 s, total=0.008 s; sync files=2, longest=0.001 s, average=0.001 s; distance=0 kB, estimate=0 kB; lsn=0/14E4F18, redo lsn=0/14E4F18\n2026-06-30 03:14:40.871 UTC [55] LOG:  database system is shut down\n done\nserver stopped\n\nPostgreSQL init process complete; ready for start up.\n\n\n"
    },
    {
      "id": "qa.root-build",
      "required": true,
      "command": "npm run build",
      "status": "failed",
      "duration_ms": 2159,
      "stdout": "[migrations:check] PASS: 309 migration(s) in /Users/brianlewis/Circle of Life/Circle-of-Life/supabase/migrations — sequence 001..306\n[check:admin-shell] PASS: all 21 top-level (admin) route prefix(es) are gated\n[check-memory-care] PASS\n  Suggestion: Wait for the build to complete.\n",
      "stderr": "⨯ Another next build process is already running.\n\n  This could be:\n  - A next build still in progress\n  - A previous build that didn't exit cleanly\n\n"
    },
    {
      "id": "hygiene.nextjs-deprecation-signal",
      "required": false,
      "status": "passed",
      "command": "(derived from npm run build output)",
      "stdout": "No tracked Next.js middleware deprecation signal in build output."
    },
    {
      "id": "qa.web-build",
      "required": false,
      "status": "skipped",
      "command": "npm run build (apps/web)",
      "stdout": "apps/web/package.json not found"
    },
    {
      "id": "chaos.stress-suite",
      "required": false,
      "status": "skipped",
      "command": "npm run stress:test",
      "stdout": "skipped (--no-chaos)"
    },
    {
      "id": "cdo.design-review",
      "required": false,
      "status": "skipped",
      "command": "npm run design:review",
      "stdout": "skipped (pass --ui to enable)"
    },
    {
      "id": "cdo.a11y-axe",
      "required": false,
      "status": "skipped",
      "command": "npm run a11y:routes",
      "stdout": "skipped (pass --ui to enable; omit --no-a11y)"
    }
  ],
  "summary": {
    "passed": 7,
    "failed": 2,
    "skipped": 4,
    "blocking_failures": [
      "qa.root-build"
    ]
  },
  "artifacts": [
    "/Users/brianlewis/Circle of Life/Circle-of-Life/test-results/agent-gates/2026-06-30T03-14-08-698Z-perf-auth-09-finance-client.json"
  ]
}