{
  "segment": "module-10-compliance-engine",
  "timestamp": "2026-04-05T00:11:06.020Z",
  "verdict": "PASS",
  "checks": [
    {
      "id": "hygiene.env-example",
      "required": true,
      "status": "passed",
      "command": "node scripts/check-env-example.mjs",
      "duration_ms": 31,
      "stdout": "[check:env-example] PASS\n",
      "stderr": ""
    },
    {
      "id": "hygiene.tracked-secrets-scan",
      "required": true,
      "status": "passed",
      "command": "node scripts/check-tracked-secrets.mjs",
      "duration_ms": 93,
      "stdout": "[check:secrets] PASS\n",
      "stderr": ""
    },
    {
      "id": "hygiene.npm-audit",
      "required": true,
      "status": "passed",
      "command": "npm run audit:ci",
      "duration_ms": 581,
      "stdout": "found 0 vulnerabilities\n",
      "stderr": ""
    },
    {
      "id": "security.gitleaks",
      "required": true,
      "status": "passed",
      "command": "npm run secrets:gitleaks",
      "duration_ms": 40138,
      "stdout": "[gitleaks] PASS\n",
      "stderr": "\n    ○\n    │╲\n    │ ○\n    ○ ░\n    ░    gitleaks\n\n\u001b[90m12:11AM\u001b[0m \u001b[32mINF\u001b[0m 95 commits scanned.\n\u001b[90m12:11AM\u001b[0m \u001b[32mINF\u001b[0m scan completed in 1.63s\n\u001b[90m12:11AM\u001b[0m \u001b[32mINF\u001b[0m no leaks found\n"
    },
    {
      "id": "qa.eslint",
      "required": true,
      "status": "passed",
      "command": "npm run lint",
      "duration_ms": 4591,
      "stdout": "",
      "stderr": ""
    },
    {
      "id": "qa.migration-sequence",
      "required": true,
      "status": "passed",
      "command": "npm run migrations:check",
      "duration_ms": 154,
      "stdout": "[migrations:check] PASS: 39 migration(s) in /Users/brianlewis/Circle of Life/Circle-of-Life/supabase/migrations — sequence 001..039\n",
      "stderr": ""
    },
    {
      "id": "qa.migrations-apply-postgres",
      "required": false,
      "status": "passed",
      "command": "npm run migrations:verify:pg",
      "duration_ms": 79116,
      "stdout": "[migrations:verify:pg] PASS (39 migration file(s))\n",
      "stderr": ""
    },
    {
      "id": "qa.root-build",
      "required": true,
      "status": "passed",
      "command": "npm run build",
      "duration_ms": 15119,
      "stdout": "[migrations:check] PASS: 39 migration(s) in /Users/brianlewis/Circle of Life/Circle-of-Life/supabase/migrations — sequence 001..039\n▲ Next.js 16.2.1 (Turbopack)\n- Environments: .env.local\n\n  Creating an optimized production build ...\n✓ Compiled successfully in 6.7s\n  Running TypeScript ...\n  Finished TypeScript in 6.9s ...\n  Collecting page data using 15 workers ...\n  Generating static pages using 15 workers (0/86) ...\n  Generating static pages using 15 workers (21/86) \r\n  Generating static pages using 15 workers (42/86) \r\n  Generating static pages using 15 workers (64/86) \r\n✓ Generating static pages using 15 workers (86/86) in 290ms\n  Finalizing page optimization ...\n\nRoute (app)\n┌ ○ /\n├ ○ /_not-found\n├ ○ /admin\n├ ○ /admin/assessments/overdue\n├ ○ /admin/billing\n├ ○ /admin/billing/ar-aging\n├ ○ /admin/billing/invoices\n├ ƒ /admin/billing/invoices/[id]\n├ ○ /admin/billing/invoices/generate\n├ ○ /admin/billing/org-ar-aging\n├ ○ /admin/billing/payments/new\n├ ○ /admin/billing/rates\n├ ○ /admin/billing/revenue\n├ ○ /admin/care-plans/reviews-due\n├ ○ /admin/certifications\n├ ○ /admin/compliance\n├ ƒ /admin/compliance/deficiencies/[id]\n├ ○ /admin/compliance/deficiencies/new\n├ ○ /admin/compliance/policies\n├ ƒ /admin/compliance/policies/[id]/edit\n├ ○ /admin/compliance/policies/new\n├ ○ /admin/family-messages\n├ ○ /admin/incidents\n├ ƒ /admin/incidents/[id]\n├ ƒ /admin/incidents/[id]/rca\n├ ○ /admin/incidents/trends\n├ ○ /admin/infection-control\n├ ƒ /admin/infection-control/[id]\n├ ○ /admin/infection-control/new\n├ ƒ /admin/infection-control/outbreaks/[id]\n├ ○ /admin/infection-control/staff-illness\n├ ○ /admin/medications\n├ ○ /admin/medications/controlled\n├ ○ /admin/medications/errors\n├ ○ /admin/medications/errors/new\n├ ○ /admin/medications/verbal-orders\n├ ○ /admin/medications/verbal-orders/new\n├ ○ /admin/residents\n├ ƒ /admin/residents/[id]\n├ ƒ /admin/residents/[id]/assessments\n├ ƒ /admin/residents/[id]/assessments/new\n├ ƒ /admin/residents/[id]/billing\n├ ƒ /admin/residents/[id]/care-plan\n├ ƒ /admin/residents/[id]/medications\n├ ƒ /admin/residents/[id]/vitals\n├ ƒ /admin/residents/[id]/vitals/thresholds\n├ ○ /admin/schedules\n├ ○ /admin/staff\n├ ƒ /admin/staff/[id]\n├ ○ /admin/staffing\n├ ○ /admin/time-records\n├ ƒ /api/controlled-substance/verify-co-sign\n├ ƒ /api/infection-control/evaluate-outbreak\n├ ƒ /api/infection-control/evaluate-vitals\n├ ○ /assessments/overdue\n├ ○ /billing\n├ ○ /billing/ar-aging\n├ ○ /billing/invoices\n├ ƒ /billing/invoices/[id]\n├ ○ /billing/invoices/generate\n├ ○ /billing/org-ar-aging\n├ ○ /billing/payments/new\n├ ○ /billing/rates\n├ ○ /billing/revenue\n├ ○ /care-plans/reviews-due\n├ ○ /caregiver\n├ ○ /caregiver/clock\n├ ○ /caregiver/controlled-count\n├ ○ /caregiver/followups\n├ ○ /caregiver/handoff\n├ ○ /caregiver/incident-draft\n├ ○ /caregiver/me\n├ ○ /caregiver/meds\n├ ○ /caregiver/policies\n├ ƒ /caregiver/policies/[id]\n├ ○ /caregiver/prn-followup\n├ ƒ /caregiver/resident/[id]\n├ ƒ /caregiver/resident/[id]/adl\n├ ƒ /caregiver/resident/[id]/behavior\n├ ƒ /caregiver/resident/[id]/condition-change\n├ ƒ /caregiver/resident/[id]/log\n├ ○ /caregiver/schedules\n├ ○ /caregiver/tasks\n├ ○ /certifications\n├ ○ /clock\n├ ○ /family\n├ ○ /family/billing\n├ ○ /family/calendar\n├ ○ /family/care-plan\n├ ○ /family/invoices\n├ ○ /family/messages\n├ ○ /family/payments\n├ ○ /followups\n├ ○ /handoff\n├ ○ /incident-draft\n├ ○ /incidents\n├ ƒ /incidents/[id]\n├ ƒ /incidents/[id]/rca\n├ ○ /incidents/trends\n├ ○ /login\n├ ○ /me\n├ ○ /meds\n├ ○ /prn-followup\n├ ƒ /resident/[id]\n├ ƒ /resident/[id]/adl\n├ ƒ /resident/[id]/behavior\n├ ƒ /resident/[id]/condition-change\n├ ƒ /resident/[id]/log\n├ ○ /residents\n├ ƒ /residents/[id]\n├ ƒ /residents/[id]/assessments\n├ ƒ /residents/[id]/assessments/new\n├ ƒ /residents/[id]/billing\n├ ƒ /residents/[id]/care-plan\n├ ƒ /residents/[id]/medications\n├ ○ /schedules\n├ ○ /staff\n├ ƒ /staff/[id]\n├ ○ /staffing\n├ ○ /tasks\n└ ○ /time-records\n\n\nƒ Proxy (Middleware)\n\n○  (Static)   prerendered as static content\nƒ  (Dynamic)  server-rendered on demand\n\n",
      "stderr": ""
    },
    {
      "id": "hygiene.nextjs-deprecation-signal",
      "required": false,
      "status": "passed",
      "command": "(derived from npm run build output)",
      "stdout": "No tracked Next.js middleware deprecation signal in build output."
    },
    {
      "id": "qa.web-build",
      "required": false,
      "status": "skipped",
      "command": "npm run build (apps/web)",
      "stdout": "apps/web/package.json not found"
    },
    {
      "id": "chaos.stress-suite",
      "required": true,
      "status": "passed",
      "command": "npm run stress:test",
      "duration_ms": 242,
      "stdout": "PASS\tstress: suite loaded\nPASS\tstress: Number.parseInt rejects garbage\nPASS\tstress: parallel microtasks both ran\nADVISORY\tstress: add ALF/home-care workflow simulations when resident and census models exist\n",
      "stderr": ""
    },
    {
      "id": "cdo.design-review",
      "required": true,
      "status": "passed",
      "command": "npm run design:review",
      "duration_ms": 4897,
      "stdout": "[design:review] PASS: 4 screenshot(s) -> /Users/brianlewis/Circle of Life/Circle-of-Life/test-results/design-review/report.json\n",
      "stderr": "",
      "artifacts": [
        "/Users/brianlewis/Circle of Life/Circle-of-Life/test-results/design-review/report.json"
      ]
    },
    {
      "id": "cdo.a11y-axe",
      "required": true,
      "status": "passed",
      "command": "npm run a11y:routes",
      "duration_ms": 2387,
      "stdout": "[a11y:routes] PASS (1 route(s))\n",
      "stderr": ""
    }
  ],
  "summary": {
    "passed": 12,
    "failed": 0,
    "skipped": 1,
    "blocking_failures": []
  },
  "artifacts": [
    "/Users/brianlewis/Circle of Life/Circle-of-Life/test-results/agent-gates/2026-04-05T00-11-06-020Z-module-10-compliance-engine.json"
  ]
}