{
  "segment": "SMART-ROUNDING-CLOSEOUT-20260920",
  "timestamp": "2026-09-20T04:47:17.709Z",
  "verdict": "FAIL",
  "checks": [
    {
      "id": "hygiene.env-example",
      "required": true,
      "command": "node scripts/check-env-example.mjs",
      "status": "passed",
      "duration_ms": 124,
      "stdout": "[check:env-example] PASS\n",
      "stderr": ""
    },
    {
      "id": "hygiene.tracked-secrets-scan",
      "required": true,
      "command": "node scripts/check-tracked-secrets.mjs",
      "status": "passed",
      "duration_ms": 978,
      "stdout": "[check:secrets] PASS\n",
      "stderr": ""
    },
    {
      "id": "hygiene.npm-audit",
      "required": true,
      "command": "npm run audit:ci",
      "status": "passed",
      "duration_ms": 2664,
      "stdout": "found 0 vulnerabilities\n",
      "stderr": ""
    },
    {
      "id": "security.gitleaks",
      "required": true,
      "command": "npm run secrets:gitleaks",
      "status": "passed",
      "duration_ms": 30644,
      "stdout": "[gitleaks] detector regression PASS: generic-api-key remains active\n[gitleaks] PASS\n",
      "stderr": "\n    ○\n    │╲\n    │ ○\n    ○ ░\n    ░    gitleaks\n\n12:47AM INF 2315 commits scanned.\n12:47AM INF scanned ~106124776 bytes (106.12 MB) in 29.9s\n12:47AM INF no leaks found\n"
    },
    {
      "id": "qa.eslint",
      "required": true,
      "command": "npm run lint",
      "status": "passed",
      "duration_ms": 116822,
      "stdout": "Constitution lint passed for smart-rounding scope (62 files).\n",
      "stderr": ""
    },
    {
      "id": "qa.migration-sequence",
      "required": true,
      "command": "npm run migrations:check",
      "status": "passed",
      "duration_ms": 363,
      "stdout": "[migrations:check] PASS: 441 migration(s) in /Users/brianlewis/Circle of Life/Haven Smart Rounding Closeout/supabase/migrations — sequence 001..438\n",
      "stderr": ""
    },
    {
      "id": "qa.migrations-apply-postgres",
      "required": true,
      "command": "npm run migrations:verify:pg",
      "status": "passed",
      "duration_ms": 106447,
      "stdout": "[care-events:parity] PASS (105 cases, psql)\n[migrations:verify:pg] PASS (441 migration files, 83 SQL probes, 7 acceptance suites, level parity; native PostgreSQL with Supabase stubs)\n",
      "stderr": ""
    },
    {
      "id": "qa.root-build",
      "required": true,
      "command": "npm run build",
      "status": "failed",
      "duration_ms": 3404,
      "stdout": "[migrations:check] PASS: 441 migration(s) in /Users/brianlewis/Circle of Life/Haven Smart Rounding Closeout/supabase/migrations — sequence 001..438\n[sql:hosted] PASS: 441 migration file(s), no public-qualified extension calls\n[check:admin-shell] PASS: all 21 top-level (admin) route prefix(es) are gated\n[check-memory-care] PASS\n▲ Next.js 16.3.4 (Turbopack)\n✓ Running next.config.ts took 320ms\n- Experiments (use with caution):\n  · clientTraceMetadata\n  · optimizePackageImports\n\n  Creating an optimized production build ...\n",
      "stderr": "[@sentry/nextjs] Importing `withSentryConfig` from `@sentry/nextjs` is deprecated and will stop working in v11. Import it from `@sentry/nextjs/config` instead:\n  import { withSentryConfig } from '@sentry/nextjs/config';\n[@sentry/nextjs] Importing `withSentryConfig` from `@sentry/nextjs` is deprecated and will stop working in v11. Import it from `@sentry/nextjs/config` instead:\n  import { withSentryConfig } from '@sentry/nextjs/config';\n\n-----\n\u001b[1m\u001b[31mFATAL\u001b[39m\u001b[0m: An unexpected Turbopack error occurred. A panic log has been written to /var/folders/hs/_qwvnh5s2h194qyh71087psm0000gn/T/next-panic-2ce7312ea6783fd670623ad4c43f2af5.log.\n\nTo help make Turbopack better, report this error by clicking here: https://bugs.nextjs.org/search?category=turbopack-error-report&title=Turbopack%20Error%3A%20Symlink%20%5Bproject%5D%2Fnode_modules%20is%20invalid%2C%20it%20points%20out%20of%20the%20filesystem%20root&body=Turbopack%20version%3A%20%60299180d3%60%0ANext.js%20version%3A%20%600.0.0%60%0A%0AError%20message%3A%0A%60%60%60%0ASymlink%20%5Bproject%5D%2Fnode_modules%20is%20invalid%2C%20it%20points%20out%20of%20the%20filesystem%20root%0A%0ADebug%20info%3A%0A-%20Execution%20of%20get_all_written_entrypoints_with_issues_operation%20failed%0A-%20Execution%20of%20EntrypointsOperation%3A%3Anew%20failed%0A-%20Execution%20of%20all_entrypoints_write_to_disk_operation%20failed%0A-%20Execution%20of%20output_assets_operation%20failed%0A-%20Execution%20of%20Project%3A%3Aget_all_endpoint_groups_with_app_route_filter%20failed%0A-%20Execution%20of%20Project%3A%3Aentrypoints_with_app_route_filter%20failed%0A-%20Execution%20of%20AppProject%3A%3Aroutes_with_filter%20failed%0A-%20Execution%20of%20directory_tree_to_entrypoints_internal%20failed%0A-%20Execution%20of%20directory_tree_to_loader_tree%20failed%0A-%20Execution%20of%20try_get_next_package%20failed%0A-%20Execution%20of%20resolve%20failed%0A-%20Execution%20of%20resolve_internal%20failed%0A-%20Execution%20of%20find_package%20failed%0A-%20Symlink%20%5Bproject%5D%2Fnode_modules%20is%20invalid%2C%20it%20points%20out%20of%20the%20filesystem%20root%0A%60%60%60&labels=Turbopack,Turbopack%20Panic%20Backtrace\n-----\n\n\n> Build error occurred\nError [TurbopackInternalError]: Symlink [project]/node_modules is invalid, it points out of the filesystem root\n\nDebug info:\n- Execution of get_all_written_entrypoints_with_issues_operation failed\n- Execution of EntrypointsOperation::new failed\n- Execution of all_entrypoints_write_to_disk_operation failed\n- Execution of output_assets_operation failed\n- Execution of Project::get_all_endpoint_groups_with_app_route_filter failed\n- Execution of Project::entrypoints_with_app_route_filter failed\n- Execution of AppProject::routes_with_filter failed\n- Execution of directory_tree_to_entrypoints_internal failed\n- Execution of directory_tree_to_loader_tree failed\n- Execution of try_get_next_package failed\n- Execution of resolve failed\n- Execution of resolve_internal failed\n- Execution of find_package failed\n- Symlink [project]/node_modules is invalid, it points out of the filesystem root\n    at ignore-listed frames {\n  type: 'TurbopackInternalError',\n  location: undefined\n}\n"
    },
    {
      "id": "hygiene.nextjs-deprecation-signal",
      "required": false,
      "status": "passed",
      "command": "(derived from npm run build output)",
      "stdout": "No tracked Next.js middleware deprecation signal in build output."
    },
    {
      "id": "qa.web-build",
      "required": false,
      "status": "skipped",
      "command": "npm run build (apps/web)",
      "stdout": "apps/web/package.json not found"
    },
    {
      "id": "chaos.stress-suite",
      "required": true,
      "command": "npm run stress:test",
      "status": "passed",
      "duration_ms": 453,
      "stdout": "PASS\t18,000 compliance rows retained through 132 capped pages; every cut excludes configuration gaps\nPASS\tChanging or interrupted pagination fails instead of presenting partial compliance\n",
      "stderr": ""
    },
    {
      "id": "cdo.preview-prerequisite",
      "required": true,
      "status": "failed",
      "command": "start verified UI preview",
      "stderr": "UI verification cannot start because the production build failed."
    }
  ],
  "summary": {
    "passed": 9,
    "failed": 2,
    "skipped": 1,
    "blocking_failures": [
      "qa.root-build",
      "cdo.preview-prerequisite"
    ]
  },
  "artifacts": [
    "/Users/brianlewis/Circle of Life/Haven Smart Rounding Closeout/test-results/agent-gates/2026-09-20T04-47-17-709Z-SMART-ROUNDING-CLOSEOUT-20260920.json"
  ]
}